STU601,Shlok Kapur,CSD,79,80,7.2,6.91,7.01,7.24,6.73,6.61,6.77,6.6,6.83,0,No,Pass,C2,DevOps; DBMS; Data Structures & Algorithms; Programming; Cloud Computing; Machine Learning; Time Management; Communication; Emotional Intelligence
STU602,Fateh Konda,CSE,87,82,8.77,9.25,8.89,8.7,9.21,9.04,8.98,9.35,9.02,0,Yes,Pass,C1,Operating Systems; Machine Learning; Computer Networks; Programming; DBMS; Data Structures & Algorithms; Cloud Computing; Interpersonal Skills; Creativity; Leadership
STU603,Mahika Kuruvilla,CSE-AIML,55,51,8.23,8.12,7.92,7.9,7.85,8.02,8.24,8.17,8.12,2,No,Backlog,C5,Computer Vision; Programming; Data Structures & Algorithms; Natural Language Processing; Machine Learning; Deep Learning; Artificial Intelligence; Teamwork; Creativity; Leadership
STU604,Umang Date,IT,95,84,7.95,7.95,8.1,8.04,7.69,7.8,7.97,7.59,7.89,2,No,Backlog,C4,Mobile App Development; DBMS; Cybersecurity; Programming; Data Structures & Algorithms; Web Development; Emotional Intelligence; Communication; Creativity
STU605,Divit Ravi,CSE,87,78,9.34,9.25,9.64,9.38,9.84,9.5,9.83,9.45,9.66,0,No,Pass,C1,DBMS; Operating Systems; Data Structures & Algorithms; Machine Learning; Programming; Cloud Computing; Interpersonal Skills; Critical Thinking; Communication
STU606,Badal Kant,CSD,98,92,9.99,9.8,9.88,9.66,9.71,9.94,10,9.82,9.79,0,Yes,Pass,C1,DBMS; Data Visualization; Cloud Computing; Programming; DevOps; Data Structures & Algorithms; Machine Learning; Leadership; Critical Thinking; Adaptability
STU607,Taimur Sandhu,CSE,84,79,8.32,8.34,8.42,8.6,7.98,8.96,8.23,8.23,8.33,0,No,Pass,C1,DBMS; Machine Learning; Programming; Operating Systems; Cloud Computing; Data Structures & Algorithms; Time Management; Creativity; Leadership
STU608,Neelofar Khalsa,EC,83,77,9.88,9.05,9.44,9.16,9.57,9.18,9.78,9.11,9.55,0,No,Pass,C1,Digital Electronics; VLSI Design; Embedded Systems; Communication Systems; Teamwork; Emotional Intelligence
STU609,Indrans Master,EC,75,92,8.78,8.53,8.44,8.55,8.22,8.82,8.49,8.4,8.48,0,No,Pass,C1,Analog Circuits; Communication Systems; Creativity; Communication
STU610,Lakshay Handa,CSE,75,84,8.16,8.68,8.24,8.61,8.31,8.94,8.35,8.76,8.36,0,Yes,Pass,C1,Data Structures & Algorithms; DBMS; Operating Systems; Cloud Computing; Computer Networks; Machine Learning; Adaptability; Critical Thinking
STU611,Shayak Sama,CSE,76,71,7.32,7.7,6.66,7.68,7.26,7.6,7.06,7.76,7.34,0,No,Pass,C1,Cloud Computing; Operating Systems; Programming; Data Structures & Algorithms; Machine Learning; Critical Thinking; Communication
STU612,Emir Gala,CSD,57,58,5.9,5.68,5.56,5.45,6.01,5.35,5.68,5.93,5.6,0,Yes,Pass,C5,Machine Learning; Data Structures & Algorithms; Data Visualization; DBMS; Cloud Computing; DevOps; Programming; Leadership; Emotional Intelligence; Creativity
STU613,Jivika Bhardwaj,ME,52,50,8.73,8.93,7.96,8.24,8.48,8.19,8.48,8.37,8.6,0,No,Pass,C5,"Mechanical Design, Machine Elements, ANSYS, Critical Thinking; Emotional Intelligence; Leadership; Critical Thinking"
STU614,Anaya Gour,IT,87,84,6.08,5.99,6.16,6.16,6.03,6.42,6.2,6.06,6.14,3,No,Backlog,C4,Data Structures & Algorithms; Mobile App Development; Web Development; Operating Systems; Cybersecurity; Programming; DBMS; Critical Thinking; Interpersonal Skills
STU615,Lakshay Goswami,CSE,66,73,7.44,7.37,6.95,7.17,7.22,7.61,7.32,6.8,7.16,0,No,Pass,C2,DBMS; Cloud Computing; Programming; Operating Systems; Data Structures & Algorithms; Adaptability; Communication; Interpersonal Skills
STU616,Lagan Sundaram,CSD,81,85,7.82,7.42,7.67,7.3,7.63,7.77,7.93,7.76,7.59,1,No,Backlog,C3,Data Structures & Algorithms; Cloud Computing; DevOps; Machine Learning; Programming; Communication; Creativity
STU617,Renee Mangat,EC,83,78,9.63,9.91,9.69,9.37,9.62,9.87,10,9.67,9.76,0,No,Pass,C1,Communication Systems; VLSI Design; Microprocessors & Microcontrollers; Embedded Systems; Interpersonal Skills; Teamwork; Critical Thinking
STU618,Dhanush Contractor,CSD,68,91,7.18,7.07,7.48,7.56,7.87,7.31,7.53,7.55,7.46,0,No,Pass,C2,Cloud Computing; DBMS; Programming; Machine Learning; Data Structures & Algorithms; Data Visualization; DevOps; Teamwork; Creativity; Adaptability
STU619,Tanya Choudhary,CSD,94,83,8.48,8.06,8.3,8.07,8.26,8.35,8.55,8.05,8.18,0,Yes,Pass,C1,DevOps; DBMS; Data Visualization; Machine Learning; Data Structures & Algorithms; Cloud Computing; Emotional Intelligence; Problem Solving
STU620,Biju Lal,Civil,78,93,8.82,8.71,8.57,8.96,8.88,8.38,8.75,8.57,8.83,0,No,Pass,C1,AutoCAD; Geotechnical Engineering; Creativity; Problem Solving; Emotional Intelligence
STU621,Heer Johal,IT,81,98,7.87,8.58,8.34,8.04,7.9,7.86,8.13,7.84,8.07,0,No,Pass,C1,Operating Systems; Data Structures & Algorithms; Mobile App Development; Programming; Time Management; Emotional Intelligence; Leadership
STU622,Ojas Dhar,Civil,91,79,9.53,9.69,10,9.34,10,9.59,9.76,9.44,9.69,0,No,Pass,C1,Geotechnical Engineering; Building Materials; Teamwork; Critical Thinking
STU623,Dishani Mall,IT,89,70,7.94,8.11,7.77,8.39,7.95,8.01,8.32,8.08,8.2,0,Yes,Pass,C1,Data Structures & Algorithms; Operating Systems; Mobile App Development; Web Development; DBMS; Cybersecurity; Programming; Interpersonal Skills; Problem Solving
STU624,Diya Kohli,CSE-AIML,90,84,8.28,8.16,8.19,7.48,8.26,7.8,7.63,7.67,7.8,0,No,Pass,C1,Data Structures & Algorithms; Artificial Intelligence; Machine Learning; Natural Language Processing; Deep Learning; Programming; Computer Vision; Interpersonal Skills; Leadership; Emotional Intelligence
STU625,Navya Dhar,EC,98,73,6.27,6.43,6.39,6.26,6.04,6.49,5.75,6.51,6.32,3,No,Backlog,C4,VLSI Design; Signal Processing; Microprocessors & Microcontrollers; Analog Circuits; Critical Thinking; Creativity; Interpersonal Skills
STU626,Amani Ahuja,CSD,56,53,6.43,6.63,6.66,6.28,6.2,6.51,6.41,6.28,6.32,1,No,Backlog,C5,Programming; DevOps; Data Structures & Algorithms; Data Visualization; Interpersonal Skills; Adaptability
STU627,Samar Batta,Civil,93,82,6.26,6.4,6.17,6.74,6.58,6.33,6.73,6.28,6.47,4,No,Fail,C4,Structural Analysis; Surveying; Transportation Engineering; AutoCAD; Interpersonal Skills; Leadership
STU628,Tarini Banik,CSE,82,82,9.4,8.86,9.52,9.33,9,8.79,8.64,9.03,8.97,0,No,Pass,C1,Machine Learning; Data Structures & Algorithms; Cloud Computing; Programming; Operating Systems; Computer Networks; DBMS; Leadership; Critical Thinking
STU629,Nishith Bhandari,Civil,80,89,8.05,7.72,8.03,7.58,8.04,7.65,7.68,7.67,7.8,0,No,Pass,C1,Transportation Engineering; Surveying; Structural Analysis; Creativity; Emotional Intelligence; Adaptability
STU630,Taimur Anne,CSD,89,81,9.74,9.53,9.47,9.77,9.36,9.73,9.49,9.79,9.55,0,No,Pass,C1,Cloud Computing; Programming; Data Visualization; DBMS; Creativity; Leadership
STU631,Ivana Shan,CSD,77,82,8.17,8.52,8.46,8.71,8.6,8.29,8.7,8.67,8.43,0,No,Pass,C1,Programming; DBMS; Data Structures & Algorithms; Machine Learning; DevOps; Adaptability; Problem Solving
STU632,Abram Goel,IT,71,96,7.65,8.11,7.94,7.89,7.55,7.92,8.13,7.32,7.81,0,No,Pass,C1,Mobile App Development; Cybersecurity; Programming; Data Structures & Algorithms; DBMS; Web Development; Operating Systems; Interpersonal Skills; Time Management
STU633,Aaina Ravi,CSE,58,55,6.94,6.65,7.29,6.96,6.61,7.23,7.06,6.79,7.09,2,No,Backlog,C5,Programming; DBMS; Data Structures & Algorithms; Computer Networks; Cloud Computing; Interpersonal Skills; Emotional Intelligence
STU634,Anika Chada,CSE,66,76,6.87,7.05,7.21,7.29,6.97,7,6.96,7.33,7.21,3,No,Backlog,C4,Cloud Computing; DBMS; Computer Networks; Data Structures & Algorithms; Adaptability; Problem Solving
STU635,Shamik Bassi,CSE,79,78,8.82,8.38,8.19,8.12,7.98,8.18,8.29,8.46,8.37,0,Yes,Pass,C1,Programming; DBMS; Operating Systems; Machine Learning; Computer Networks; Data Structures & Algorithms; Cloud Computing; Time Management; Emotional Intelligence
STU636,Hrishita Dey,IT,70,98,9.65,9.55,9.41,9.44,9.46,9.31,9.43,9.13,9.47,0,Yes,Pass,C1,Web Development; DBMS; Data Structures & Algorithms; Cybersecurity; Mobile App Development; Programming; Interpersonal Skills; Communication
STU637,Shaan Borah,IT,77,90,9.71,9.2,9.19,9.57,8.92,9.57,9.8,9.27,9.42,0,Yes,Pass,C1,Mobile App Development; Web Development; Data Structures & Algorithms; Cybersecurity; Programming; Operating Systems; Leadership; Teamwork
STU638,Zara Hayre,IT,85,90,8.18,8.12,8.61,8.24,8.25,8.67,8.73,8.8,8.4,0,Yes,Pass,C1,Mobile App Development; DBMS; Operating Systems; Programming; Critical Thinking; Creativity; Leadership
STU639,Hansh Soman,Civil,89,97,9.16,9.17,9.5,8.9,9.47,9.48,9.17,9.2,9.19,0,No,Pass,C1,Transportation Engineering; AutoCAD; Building Materials; Surveying; Emotional Intelligence; Creativity; Critical Thinking
STU640,Prerak Ganesh,EC,87,89,7.87,7.64,7.68,7.71,8.08,7.63,7.41,7.41,7.63,0,No,Pass,C1,Communication Systems; Digital Electronics; Problem Solving; Communication; Creativity
STU641,Arhaan Sachdeva,CSD,81,84,8.14,7.87,7.82,8.04,8.22,8.49,7.93,8.05,8.07,0,Yes,Pass,C1,Cloud Computing; Data Visualization; DBMS; Machine Learning; Communication; Emotional Intelligence
STU642,Vedika Mangat,CSD,72,75,7.3,7.63,7.43,7.56,7.59,7.58,7.73,7.43,7.59,0,No,Pass,C1,Programming; Data Structures & Algorithms; DBMS; Data Visualization; Machine Learning; Adaptability; Communication; Time Management
STU643,Gatik Dasgupta,CSE-AIML,87,79,8.52,8.62,8.36,8.92,8.58,8.72,8.71,8.84,8.53,0,No,Pass,C1,Natural Language Processing; Deep Learning; Computer Vision; Machine Learning; Data Structures & Algorithms; Programming; Artificial Intelligence; Problem Solving; Communication
STU644,Abram Sood,IT,95,84,9.7,9.67,9.24,9.09,9.61,9.56,9.87,9.95,9.56,0,No,Pass,C1,Operating Systems; Programming; Mobile App Development; Web Development; Teamwork; Emotional Intelligence; Adaptability
STU645,Aaina Sundaram,EE,66,69,7.27,7.17,7.03,7.66,7.02,7.62,7.02,7.48,7.45,4,No,Fail,C4,Power Electronics; Control Systems; Circuit Theory; Interpersonal Skills; Adaptability
STU646,Hiran Lalla,IT,86,97,8.76,8.71,8.47,8.91,8.51,8.75,8.4,8.79,8.8,0,Yes,Pass,C1,Web Development; DBMS; Operating Systems; Cybersecurity; Mobile App Development; Data Structures & Algorithms; Teamwork; Time Management
STU647,Vidur Banik,IT,74,81,7.36,7.41,7.35,7.46,7.8,7.52,7.63,7.32,7.5,2,Yes,Backlog,C4,Programming; Data Structures & Algorithms; Cybersecurity; Operating Systems; Mobile App Development; Leadership; Teamwork
STU648,Dharmajan Chaudhuri,IT,98,90,8.5,8.05,7.88,7.96,7.32,8.07,7.78,7.37,7.81,0,No,Pass,C1,DBMS; Web Development; Mobile App Development; Data Structures & Algorithms; Critical Thinking; Leadership
STU649,Zaina Sachdeva,CSE-AIML,82,84,7.6,7.22,7.32,7.22,7.34,7.02,7.39,7.27,7.17,0,No,Pass,C1,Artificial Intelligence; Computer Vision; Deep Learning; Programming; Natural Language Processing; Leadership; Critical Thinking
STU650,Dhanush Bala,CSD,71,86,9.31,9.99,9.37,9.3,9.26,9.26,9.53,9.55,9.39,0,No,Pass,C1,Programming; DBMS; Data Structures & Algorithms; Data Visualization; Machine Learning; Time Management; Adaptability
STU651,Nehmat Rege,IT,95,68,7.09,6.96,7.22,7.16,6.99,7.08,7.34,7.39,7.02,4,No,Fail,C4,Programming; Cybersecurity; Operating Systems; Data Structures & Algorithms; DBMS; Creativity; Problem Solving
STU652,Devansh Madan,CSD,78,71,7.32,7.55,7.72,7.3,7.44,7.81,7.36,7.31,7.56,0,Yes,Pass,C1,Cloud Computing; DevOps; Machine Learning; DBMS; Programming; Data Visualization; Adaptability; Time Management
STU653,Tiya Dube,CSD,79,83,9.01,8.58,9.26,9.06,9.05,9.39,9.41,9.17,9.13,0,No,Pass,C1,Data Structures & Algorithms; DBMS; Machine Learning; Data Visualization; DevOps; Adaptability; Emotional Intelligence
STU654,Rohan Randhawa,ME,86,83,7.58,7.65,7.57,7.55,7.54,7.12,7.84,7.55,7.61,0,No,Pass,C1,"Mechatronics, Microcontrollers, Sensors, Creativity; Communication; Teamwork; Problem Solving"
STU655,Zara Koshy,Civil,53,57,8.61,8.71,8.37,8.52,8.6,8.53,8.17,8.49,8.46,2,No,Backlog,C5,Building Materials; Surveying; Emotional Intelligence; Teamwork
STU656,Jivika Ravel,CSE-AIML,75,77,8.34,7.98,8.08,8.27,8.28,8.28,8.24,8.45,8.1,0,Yes,Pass,C1,Natural Language Processing; Computer Vision; Artificial Intelligence; Deep Learning; Data Structures & Algorithms; Machine Learning; Programming; Adaptability; Problem Solving; Teamwork
STU657,Uthkarsh Lala,IT,94,91,8.19,8.24,7.75,7.77,8.29,8.25,7.78,7.39,7.87,2,No,Backlog,C4,Operating Systems; Web Development; Mobile App Development; Data Structures & Algorithms; Emotional Intelligence; Problem Solving; Communication
STU658,Riya Bumb,CSE-AIML,93,78,7.33,7.61,7.05,8.06,7.09,6.83,6.75,6.75,7.25,2,No,Backlog,C4,Machine Learning; Deep Learning; Computer Vision; Data Structures & Algorithms; Natural Language Processing; Interpersonal Skills; Critical Thinking; Emotional Intelligence
STU659,Indrajit Sha,EC,93,85,9.21,9.06,9.09,9.15,9.44,8.89,9.38,8.83,9.17,0,No,Pass,C1,VLSI Design; Embedded Systems; Digital Electronics; Communication Systems; Critical Thinking; Communication; Adaptability
STU660,Tiya Malhotra,CSE,94,93,10,9.47,10,9.76,9.86,9.68,10,9.89,9.74,0,No,Pass,C1,Cloud Computing; Programming; DBMS; Machine Learning; Operating Systems; Time Management; Problem Solving; Interpersonal Skills
STU661,Anika Koshy,EE,85,98,8.75,9.47,8.97,9.15,8.91,9.3,8.71,9.38,9.2,0,No,Pass,C1,Electrical Machines; Power Systems; Emotional Intelligence; Leadership; Interpersonal Skills
STU662,Mehul Sahota,CSE,68,64,7.12,6.86,6.99,7.07,7.08,7.04,7.12,7.1,7.03,4,Yes,Fail,C4,Computer Networks; Machine Learning; Cloud Computing; Operating Systems; Problem Solving; Time Management; Emotional Intelligence
STU663,Anahi Sachdev,IT,88,82,8.06,8.95,8.75,8.07,8.41,8.6,8.87,8.55,8.38,0,No,Pass,C1,Programming; Data Structures & Algorithms; Cybersecurity; DBMS; Interpersonal Skills; Critical Thinking; Time Management
STU664,Ojas Apte,IT,78,76,6.43,6.89,6.73,6.56,6.83,6.89,6.48,7.53,6.73,5,No,Fail,C4,Web Development; DBMS; Mobile App Development; Operating Systems; Data Structures & Algorithms; Programming; Creativity; Leadership; Time Management
STU665,Baiju Bhagat,IT,56,55,8.53,8.82,8.68,8.65,9.17,8.44,8.6,8.58,8.64,0,Yes,Pass,C5,DBMS; Mobile App Development; Cybersecurity; Web Development; Time Management; Leadership
STU666,Elakshi Garg,CSD,91,97,6.62,6.33,6.07,6.26,6.39,6.76,6.26,6.06,6.39,5,No,Fail,C4,Data Visualization; DevOps; Machine Learning; Programming; Creativity; Problem Solving
STU667,Anaya Bahri,CSD,61,89,7.93,8.09,8,7.83,7.8,7.56,7.87,7.54,7.77,1,No,Backlog,C3,Programming; Machine Learning; Cloud Computing; Data Visualization; Problem Solving; Emotional Intelligence; Adaptability
STU668,Piya Mangat,CSD,91,93,7.52,7.77,7.86,7.34,7.79,7.22,7.84,7.83,7.78,0,Yes,Pass,C1,Machine Learning; DBMS; Cloud Computing; Data Structures & Algorithms; Programming; Data Visualization; DevOps; Communication; Creativity
STU669,Rasha Mall,Civil,63,63,7.35,7.55,7.52,7.79,7.59,7.89,7.55,7.67,7.7,2,No,Backlog,C4,Surveying; Structural Analysis; Creativity; Problem Solving
STU670,Prisha Chaudhry,CSE,51,52,8.17,8.53,8.21,8.26,8.18,8.32,8.32,8.11,8.22,2,No,Backlog,C5,Machine Learning; Cloud Computing; Data Structures & Algorithms; DBMS; Operating Systems; Computer Networks; Leadership; Communication; Emotional Intelligence
STU671,Taran Kunda,CSE,96,79,7.84,8.12,8.27,8.24,8.4,7.49,7.74,8.2,8.1,0,No,Pass,C1,Cloud Computing; DBMS; Operating Systems; Programming; Machine Learning; Computer Networks; Data Structures & Algorithms; Teamwork; Critical Thinking
STU672,Vihaan Saxena,EC,92,68,7.75,7.77,7.27,7.09,7.43,7.91,7.04,7.47,7.31,0,No,Pass,C2,Signal Processing; Analog Circuits; Microprocessors & Microcontrollers; Interpersonal Skills; Problem Solving; Time Management
STU673,Gokul Bhatti,CSE-AIML,72,95,7.15,7.71,7.39,6.86,7.22,7.89,7.27,7.87,7.45,0,Yes,Pass,C1,Machine Learning; Natural Language Processing; Computer Vision; Data Structures & Algorithms; Deep Learning; Artificial Intelligence; Programming; Critical Thinking; Interpersonal Skills
STU674,Jivin Atwal,IT,98,78,6.66,6.58,6.89,6.66,6.32,6.81,6.4,6.42,6.7,2,Yes,Backlog,C4,Data Structures & Algorithms; Operating Systems; Cybersecurity; Web Development; Programming; DBMS; Mobile App Development; Teamwork; Communication; Adaptability
STU675,Hazel Srinivas,CSE-AIML,93,92,6.86,7.06,6.86,6.58,7.05,6.43,7.03,6.75,6.68,0,No,Pass,C2,Artificial Intelligence; Computer Vision; Data Structures & Algorithms; Deep Learning; Problem Solving; Critical Thinking; Teamwork
STU676,Kabir Tata,CSD,98,90,9.9,9.67,10,10,9.58,9.69,9.47,9.59,9.74,0,No,Pass,C1,Data Structures & Algorithms; DevOps; Cloud Computing; Machine Learning; DBMS; Programming; Data Visualization; Problem Solving; Teamwork; Communication
STU677,Siya Hans,IT,74,92,8.27,7.62,7.18,7.98,7.43,7.71,8.13,7.29,7.7,5,Yes,Fail,C4,Programming; Web Development; Mobile App Development; Cybersecurity; Data Structures & Algorithms; Adaptability; Communication; Leadership
STU678,Abram Ramesh,CSE,75,98,8.99,8.13,8.61,8.74,8.23,8.29,8.94,8.75,8.57,0,Yes,Pass,C1,Operating Systems; Computer Networks; Programming; DBMS; Adaptability; Critical Thinking
STU679,Reyansh Barman,Civil,85,78,6.73,6.69,6.44,6.66,6.41,6.69,6.82,6.2,6.76,1,No,Backlog,C3,Building Materials; Surveying; AutoCAD; Structural Analysis; Problem Solving; Emotional Intelligence
STU680,Heer Majumdar,CSE-AIML,98,97,8.86,8.78,8.85,8.94,8.25,8.95,8.84,8.4,8.59,0,Yes,Pass,C1,Data Structures & Algorithms; Computer Vision; Artificial Intelligence; Natural Language Processing; Machine Learning; Deep Learning; Programming; Interpersonal Skills; Teamwork; Critical Thinking
STU681,Aarna Barad,CSE-AIML,77,96,9.19,8.78,8.8,9.42,8.9,9.23,9.1,9.33,9.12,0,No,Pass,C1,Programming; Data Structures & Algorithms; Natural Language Processing; Machine Learning; Teamwork; Emotional Intelligence
STU682,Sumer Basak,ME,89,78,9.86,9.41,9.59,10,9.54,9.53,9.7,9.6,9.59,0,No,Pass,C1,"Production Engineering, Industrial Engineering, Quality Control, Teamwork; Problem Solving; Critical Thinking"
STU683,Ishaan Tripathi,CSE-AIML,82,98,8.11,8.33,7.92,7.95,8.31,8.73,8.05,7.94,8.16,0,No,Pass,C1,Programming; Machine Learning; Artificial Intelligence; Deep Learning; Computer Vision; Natural Language Processing; Data Structures & Algorithms; Communication; Interpersonal Skills; Time Management
STU684,Elakshi Vohra,EE,90,81,7.75,7.37,7.5,8.07,7.9,7.91,7.46,7.64,7.7,0,No,Pass,C1,Circuit Theory; Control Systems; Power Electronics; Problem Solving; Time Management; Adaptability
STU685,Devansh Salvi,CSE,87,82,8.32,8.72,8.7,8.52,8.63,7.81,8.67,8.13,8.49,0,No,Pass,C1,Computer Networks; Operating Systems; Data Structures & Algorithms; DBMS; Machine Learning; Programming; Creativity; Communication; Teamwork
STU686,Dhanush Shankar,CSD,79,61,6.45,6.8,6.99,7.1,6.66,6.94,6.66,6.9,6.77,4,Yes,Fail,C4,DevOps; Machine Learning; DBMS; Data Structures & Algorithms; Programming; Interpersonal Skills; Time Management
STU687,Alisha Buch,CSD,75,86,6.91,6.3,6.83,6.77,6.81,6.73,6.97,6.52,6.78,0,Yes,Pass,C2,Programming; Machine Learning; DevOps; Data Visualization; Data Structures & Algorithms; Cloud Computing; Time Management; Communication; Emotional Intelligence
STU688,Rania Sanghvi,CSE,95,77,8.52,8.65,8.21,8.41,8.09,8.62,7.99,7.82,8.14,0,Yes,Pass,C1,Computer Networks; Operating Systems; Cloud Computing; Machine Learning; Interpersonal Skills; Teamwork; Adaptability
STU689,Advika Chawla,EC,95,97,6.7,6.83,6.8,7.03,7.14,6.48,6.81,6.94,6.8,5,No,Fail,C4,Microprocessors & Microcontrollers; Embedded Systems; Signal Processing; Communication; Problem Solving
STU690,Sahil Khosla,EE,97,77,8.6,8.5,8.18,8.46,8.12,8.52,8.07,8.5,8.41,0,No,Pass,C1,Control Systems; Electrical Machines; Time Management; Teamwork
STU691,Himmat Kade,CSE-AIML,71,91,7.82,8.47,8.38,8.45,8.73,8.48,8.5,8.6,8.21,0,Yes,Pass,C1,Deep Learning; Artificial Intelligence; Computer Vision; Machine Learning; Teamwork; Time Management; Problem Solving
STU692,Damini Sule,CSE,85,86,9.26,8.91,9.66,9.43,8.46,9.36,9.34,9.91,9.25,0,Yes,Pass,C1,Computer Networks; Data Structures & Algorithms; Cloud Computing; DBMS; Operating Systems; Machine Learning; Leadership; Interpersonal Skills
STU693,Yasmin Krishnan,CSE-AIML,69,61,6.78,6.22,6.63,6.95,6.83,6.72,6.53,6.61,6.67,3,No,Backlog,C4,Deep Learning; Computer Vision; Natural Language Processing; Artificial Intelligence; Interpersonal Skills; Creativity
STU694,Kismat Wagle,CSE,76,86,7.28,7.59,7.52,7.45,7.17,6.9,7.1,7.26,7.36,0,Yes,Pass,C1,Cloud Computing; Machine Learning; Computer Networks; Operating Systems; Emotional Intelligence; Critical Thinking; Leadership
STU695,Piya Kanda,CSE,84,79,8.98,9.14,9.01,9.05,8.76,9.22,8.94,9.06,9,0,No,Pass,C1,Cloud Computing; Computer Networks; Machine Learning; DBMS; Emotional Intelligence; Leadership
STU696,Umang Gaba,CSE,80,84,10,10,9.94,9.77,10,9.83,9.8,9.83,9.79,0,No,Pass,C1,Computer Networks; DBMS; Cloud Computing; Machine Learning; Problem Solving; Teamwork; Time Management
STU697,Alia Sangha,IT,88,93,9.43,8.96,8.85,9.42,9.41,9.1,9.55,9.53,9.37,0,No,Pass,C1,Cybersecurity; Mobile App Development; DBMS; Operating Systems; Programming; Communication; Adaptability; Problem Solving
STU698,Saanvi Dewan,IT,93,97,7.41,7.57,7.08,7.71,7.47,7.68,8.02,7.48,7.58,0,No,Pass,C1,DBMS; Web Development; Programming; Mobile App Development; Time Management; Problem Solving; Creativity
STU699,Arhaan Sule,CSE,98,78,5.75,6.14,6.18,6.22,6.18,6.38,6.17,5.86,6.17,1,No,Backlog,C3,Operating Systems; DBMS; Data Structures & Algorithms; Computer Networks; Cloud Computing; Programming; Machine Learning; Critical Thinking; Leadership
STU700,Hrishita Issac,CSD,94,80,9.33,9.22,9.25,9.49,9.32,8.88,9.22,8.5,9.18,0,No,Pass,C1,Data Structures & Algorithms; Data Visualization; Cloud Computing; DBMS; Machine Learning; Programming; Leadership; Time Management
STU701,Jivin Cheema,CSE-AIML,71,89,7.59,7.65,7.11,7.48,7.19,7.52,7.76,7.3,7.43,5,Yes,Fail,C4,Deep Learning; Machine Learning; Natural Language Processing; Programming; Artificial Intelligence; Computer Vision; Communication; Emotional Intelligence; Critical Thinking
STU702,Sara Doshi,ME,75,79,7.54,8.35,7.74,7.49,7.98,7.8,7.75,7.99,7.96,2,No,Backlog,C4,"Thermodynamics, Fluid Mechanics, MATLAB, Analysis Skills; Teamwork; Emotional Intelligence"
STU703,Hiran Walia,EE,91,78,8.26,7.95,7.78,7.7,8.24,8.09,8.16,8.04,8.03,0,No,Pass,C1,Power Systems; Electrical Machines; Power Electronics; Problem Solving; Adaptability; Critical Thinking
STU704,Hridaan Lall,CSE,75,89,8.14,7.81,8.4,7.84,8.03,7.91,7.72,7.8,7.84,4,No,Fail,C4,Computer Networks; Data Structures & Algorithms; Operating Systems; DBMS; Machine Learning; Cloud Computing; Programming; Critical Thinking; Leadership
STU705,Renee Sankar,EC,98,92,6.19,6.38,6.52,6.02,6.34,6.53,6.5,6.17,6.42,3,No,Backlog,C4,Microprocessors & Microcontrollers; Digital Electronics; Communication Systems; VLSI Design; Emotional Intelligence; Time Management; Teamwork
STU706,Anya Seth,CSE,51,51,5.71,6,5.2,5.98,5.62,5.43,6.32,5.54,5.72,2,Yes,Backlog,C5,Data Structures & Algorithms; Cloud Computing; Operating Systems; Machine Learning; Leadership; Emotional Intelligence; Adaptability
STU707,Parinaaz Lalla,IT,87,89,8.56,8.11,8.43,8.54,8.1,8.25,8.39,8.4,8.59,0,No,Pass,C1,Operating Systems; Programming; Data Structures & Algorithms; DBMS; Cybersecurity; Critical Thinking; Interpersonal Skills
STU708,Alisha Bakshi,EC,93,97,10,9.72,9.55,9.71,9.65,9.29,9.53,9.6,9.73,0,No,Pass,C1,Communication Systems; Analog Circuits; Embedded Systems; Digital Electronics; Problem Solving; Teamwork
STU709,Renee Toor,IT,82,97,7.67,7.27,7.62,7.7,7.6,7.46,7.82,7.51,7.64,0,No,Pass,C1,Data Structures & Algorithms; DBMS; Programming; Web Development; Problem Solving; Leadership
STU710,Gatik Dhillon,EC,87,69,8.51,8.01,8.57,7.93,7.84,8.37,8.05,8,8.28,0,No,Pass,C2,VLSI Design; Analog Circuits; Embedded Systems; Communication Systems; Critical Thinking; Emotional Intelligence; Leadership
STU711,Vanya Amble,EC,76,76,7.9,8.01,7.54,7.64,7.46,7.33,7.94,7.22,7.79,0,No,Pass,C1,Embedded Systems; Digital Electronics; Analog Circuits; Creativity; Communication
STU712,Kaira Dugar,IT,51,59,5.78,5.99,5.69,5.79,5.78,6.09,5.77,6.08,5.84,0,No,Pass,C5,DBMS; Cybersecurity; Data Structures & Algorithms; Web Development; Emotional Intelligence; Interpersonal Skills
STU713,Stuvan Mani,EC,70,63,7.05,6.96,7.02,6.56,6.68,7.28,6.62,7.17,6.86,1,No,Backlog,C3,Embedded Systems; Communication Systems; VLSI Design; Critical Thinking; Interpersonal Skills
STU714,Hunar Tella,CSE,79,98,5.8,6.68,6.6,6.09,5.99,6.15,6.49,6.36,6.18,1,No,Backlog,C3,Programming; Operating Systems; Data Structures & Algorithms; Machine Learning; DBMS; Cloud Computing; Computer Networks; Emotional Intelligence; Adaptability; Time Management
STU715,Rasha Bera,IT,80,77,8.22,8.08,8.02,7.95,7.93,8.02,8.37,8.15,8.1,0,No,Pass,C1,Programming; Web Development; Data Structures & Algorithms; Operating Systems; Mobile App Development; DBMS; Cybersecurity; Communication; Critical Thinking; Problem Solving
STU716,Madhav Varty,ME,88,67,6.75,7.41,6.59,7.33,7.15,6.63,7.33,7.02,7.06,3,No,Backlog,C4,"AutoCAD, SolidWorks, CAD/CAM, Manufacturing, Problem-Solving; Time Management; Critical Thinking; Creativity"
STU717,Tarini Kuruvilla,CSD,94,90,6.6,6.82,7.35,6.55,6.92,6.35,7.13,6.59,6.98,1,No,Backlog,C3,Programming; DBMS; Data Structures & Algorithms; DevOps; Data Visualization; Cloud Computing; Creativity; Critical Thinking; Communication
STU718,Khushi Buch,CSD,91,96,9.96,9.62,10,9.88,9.91,10,9.89,9.81,9.73,0,No,Pass,C1,Data Visualization; DBMS; Programming; DevOps; Adaptability; Communication
STU719,Vihaan Bahri,CSD,94,98,7.36,7.58,7.22,7.24,7.77,7.27,7.1,7.74,7.48,0,No,Pass,C1,Machine Learning; Data Structures & Algorithms; Programming; DevOps; Cloud Computing; Data Visualization; Problem Solving; Emotional Intelligence
STU720,Sumer Singhal,EE,98,82,8.54,8.44,8.56,8.12,8.22,8.05,8.56,8.8,8.47,0,No,Pass,C1,Electrical Machines; Circuit Theory; Power Electronics; Power Systems; Teamwork; Critical Thinking
